{
  "schema": "lis.verification_report/v1",
  "kind": "verification_report",
  "report_version": "1.0",
  "attempt": {"id": "lisa1:00000000000000000000000000000002", "workflow_classification": "development_debugging"},
  "command": {"mode": "demo", "require_supported": false, "output_path_redacted": true},
  "verdict": "REGRESSION",
  "reason_codes": ["selected_token_mismatch"],
  "policy_result": {"policy": "default", "satisfied": false, "exit_code": 4, "reason": "selected_token_regression"},
  "identities": {
    "reference": {"source_sha256": "sha256:0101010101010101010101010101010101010101010101010101010101010101", "binary_sha256": "sha256:0202020202020202020202020202020202020202020202020202020202020202", "model_sha256": "sha256:0303030303030303030303030303030303030303030303030303030303030303", "config_sha256": "sha256:0404040404040404040404040404040404040404040404040404040404040404", "input_sha256": "sha256:0505050505050505050505050505050505050505050505050505050505050505", "runtime_sha256": "sha256:0606060606060606060606060606060606060606060606060606060606060606", "backend_sha256": "sha256:0707070707070707070707070707070707070707070707070707070707070707"},
    "candidate": {"source_sha256": "sha256:1111111111111111111111111111111111111111111111111111111111111111", "binary_sha256": "sha256:1212121212121212121212121212121212121212121212121212121212121212", "model_sha256": "sha256:0303030303030303030303030303030303030303030303030303030303030303", "config_sha256": "sha256:0404040404040404040404040404040404040404040404040404040404040404", "input_sha256": "sha256:0505050505050505050505050505050505050505050505050505050505050505", "runtime_sha256": "sha256:1616161616161616161616161616161616161616161616161616161616161616", "backend_sha256": "sha256:1717171717171717171717171717171717171717171717171717171717171717"}
  },
  "token_comparison": {"status": "mismatch", "reference_observed_count": 8, "candidate_observed_count": 8, "first_mismatch": {"generated_token_step": 2, "reference_token_id": 101, "candidate_token_id": 202}},
  "localization": {"layer_suspect_interval": "(layer 3, layer 4]", "intra_layer_suspect_interval": "(rope_key_output, attention_scores]"},
  "coverage": {"scope": "selected_tokens_and_bounded_llama_decode", "common_layers": [3, 4], "missing_reference_layers": [], "missing_candidate_layers": [], "common_intra_layer_stages": ["rope_key_output", "attention_scores"], "missing_reference_intra_layer_stages": [], "missing_candidate_intra_layer_stages": []},
  "numeric_confirmation": {"status": "not_performed", "confirmed_divergence_at_checkpoint": null, "confirmed_first_divergence": null},
  "evidence": {"tier": "tier1_bounded_digest", "ceiling": "bounded_suspect_interval", "nonclaims": {"tensor_equality": false, "numeric_divergence_confirmed": false, "first_divergence_confirmed": false, "whole_runtime_equivalence": false}},
  "stages": [
    {"name": "preflight", "state": "executed", "result_ref": "sha256:aaaaaaaaaaaaaaaaaaaaaaaaaaaaaaaaaaaaaaaaaaaaaaaaaaaaaaaaaaaaaaaa", "evidence_tier": "tier0_structural", "failure_class": null, "reason": null, "blocker": null},
    {"name": "reference_original_execution", "state": "executed", "result_ref": "sha256:abababababababababababababababababababababababababababababababab", "evidence_tier": "run_report", "failure_class": null, "reason": null, "blocker": null},
    {"name": "candidate_original_execution", "state": "executed", "result_ref": "sha256:cccccccccccccccccccccccccccccccccccccccccccccccccccccccccccccccc", "evidence_tier": "run_report", "failure_class": null, "reason": null, "blocker": null},
    {"name": "pass0_calibration", "state": "executed", "result_ref": "sha256:dddddddddddddddddddddddddddddddddddddddddddddddddddddddddddddddd", "evidence_tier": "tier0_structural", "failure_class": null, "reason": null, "blocker": null},
    {"name": "pass1_token_localization", "state": "executed", "result_ref": "sha256:eeeeeeeeeeeeeeeeeeeeeeeeeeeeeeeeeeeeeeeeeeeeeeeeeeeeeeeeeeeeeeee", "evidence_tier": "selected_token_array_exact", "failure_class": null, "reason": null, "blocker": null},
    {"name": "pass2_prefix_policy_reproduction", "state": "executed", "result_ref": "sha256:0000000000000000000000000000000000000000000000000000000000000000", "evidence_tier": "independent_rerun_verified", "failure_class": null, "reason": null, "blocker": null},
    {"name": "pass3a_discovery", "state": "executed", "result_ref": "sha256:1111111111111111111111111111111111111111111111111111111111111111", "evidence_tier": "tier1_bounded_digest", "failure_class": null, "reason": null, "blocker": null},
    {"name": "bounded_recapture", "state": "executed", "result_ref": "sha256:2222222222222222222222222222222222222222222222222222222222222222", "evidence_tier": "source_bound_recapture", "failure_class": null, "reason": null, "blocker": null},
    {"name": "pass3b_authoritative_localization", "state": "executed", "result_ref": "sha256:3333333333333333333333333333333333333333333333333333333333333333", "evidence_tier": "tier1_bounded_digest", "failure_class": null, "reason": null, "blocker": null},
    {"name": "pass4_intra_layer_localization", "state": "executed", "result_ref": "sha256:4444444444444444444444444444444444444444444444444444444444444444", "evidence_tier": "tier1_bounded_digest", "failure_class": null, "reason": null, "blocker": null},
    {"name": "aggregation", "state": "executed", "result_ref": "sha256:ffffffffffffffffffffffffffffffffffffffffffffffffffffffffffffffff", "evidence_tier": "product_contract_v1", "failure_class": null, "reason": null, "blocker": null},
    {"name": "cleanup", "state": "executed", "result_ref": "sha256:babababababababababababababababababababababababababababababababa", "evidence_tier": "observed_cleanup", "failure_class": null, "reason": null, "blocker": null}
  ],
  "next_action": {"code": "inspect_suspect_interval", "summary": "Inspect the bounded layer and intra-layer suspect interval."},
  "warnings": ["Numeric confirmation was not performed."],
  "cleanup": {"status": "success", "residue_status": "none_observed", "observed": true, "retained_debug": false}
}
